subreddit,text,fecha,tokens
Fitness,"Me egolifting watching someone else egolifting: ""Pathetic""",2025-04-26T12:21:39,"['egolifting', 'watching', 'someone', 'else', 'egolifting', 'pathetic']"
Fitness,"I'm doing heavy overhead presses in the corner rack which is really close to the wall. During the middle of my set, a woman squeezes by, under my barbell path, to grab a 10 lb plate from the side closest to the wall. I'm now holding the barbell completely overhead. I tell her to wait for people to be done before doing that. She gets angry, tells me to calm down and huffs off, again under the barbell path.",2025-04-26T11:35:06,"['im', 'heavy', 'overhead', 'press', 'corner', 'rack', 'really', 'close', 'wall', 'middle', 'set', 'woman', 'squeeze', 'barbell', 'path', 'grab', '10', 'lb', 'plate', 'side', 'closest', 'wall', 'im', 'holding', 'barbell', 'completely', 'overhead', 'tell', 'wait', 'people', 'done', 'get', 'angry', 'tell', 'calm', 'huff', 'barbell', 'path']"
Fitness,"I started lifting about 8 months ago. This week they had people handing out 3 day passes to a gym on campus. The guy comes up to me and says ""hey bro, it looks like you already have a gym, but do you want a 3 day pass?"" I think he is the first person to say something like that to me, and it really warmed my heart.",2025-04-26T03:19:52,"['started', 'lifting', '8', 'month', 'ago', 'week', 'people', 'handing', '3', 'day', 'pass', 'gym', 'campus', 'guy', 'come', 'say', 'hey', 'bro', 'look', 'like', 'already', 'gym', 'want', '3', 'day', 'pas', 'think', 'first', 'person', 'say', 'something', 'like', 'really', 'warmed', 'heart']"
Fitness,"Remember I posted about the lady who was on her phone talking in the shower in the women’s locker room? Well, I’ve got an update…

I was told by one of the staff members that was handling that situation that she came back the next day. She was trying to pull the same thing, then proceeded to sleep in the same locker room. She was doing this for hours on end. She was asked to leave, again and was told she was loitering.

So she left. But she didn’t leave the property. She was then yelling outside of the main entrance that “she was being harrassed, don’t come here” etc etc. which isn’t what was happening. She was the one that was making other members uncomfortable, being nasty to staff members. So she was told that if she tried to come back inside she’d be trespassing.

Guess what she did? 

Cops were called. She was arrested and banned from all YMCA’s in this area which includes 4-5 cities.",2025-04-26T04:55:19,"['remember', 'posted', 'lady', 'phone', 'talking', 'shower', 'women’s', 'locker', 'room', 'well', 'i’ve', 'got', 'update…', 'told', 'one', 'staff', 'member', 'handling', 'situation', 'came', 'back', 'next', 'day', 'trying', 'pull', 'thing', 'proceeded', 'sleep', 'locker', 'room', 'hour', 'end', 'asked', 'leave', 'told', 'loitering', 'left', 'didn’t', 'leave', 'property', 'yelling', 'outside', 'main', 'entrance', '“she', 'harrassed', 'don’t', 'come', 'here”', 'etc', 'etc', 'isn’t', 'happening', 'one', 'making', 'member', 'uncomfortable', 'nasty', 'staff', 'member', 'told', 'tried', 'come', 'back', 'inside', 'she’d', 'trespassing', 'guess', 'cop', 'called', 'arrested', 'banned', 'ymca’s', 'area', 'includes', '45', 'city']"
Fitness,"I've been trying out a new gym (a different instance of the same chain to which I have a membership), and have been silently ranting in my head about their dual cable machines not having weight indicators on the plates (only incrementing numbers). Today I realised that the weights are printed on the rear of the plates (facepalm). I started updating my Hevy routine before realising this would throw out all my previous recorded sessions .... so now sitting at home post-workout and reversing the changes.

Good times.

(Aware that weights don't actually matter on these machines, but I'm a numbers-driven nerd and have always used weights before when possible).",2025-04-26T04:28:37,"['ive', 'trying', 'new', 'gym', 'different', 'instance', 'chain', 'membership', 'silently', 'ranting', 'head', 'dual', 'cable', 'machine', 'weight', 'indicator', 'plate', 'incrementing', 'number', 'today', 'realised', 'weight', 'printed', 'rear', 'plate', 'facepalm', 'started', 'updating', 'hevy', 'routine', 'realising', 'would', 'throw', 'previous', 'recorded', 'session', 'sitting', 'home', 'postworkout', 'reversing', 'change', 'good', 'time', 'aware', 'weight', 'dont', 'actually', 'matter', 'machine', 'im', 'numbersdriven', 'nerd', 'always', 'used', 'weight', 'possible']"
Fitness,"My gym has two floors with the second floor having a separate VIP section. I went into the VIP section and immediately got smacked in the face by the wettest, stankiest, most putrid smell of shit. That WMD-level protein-induced ass permeated the entire VIP floor. Teary eyed, squinting, I could see the silhouette of a 4’10” girl by the squat rack in the corner. Ngl Im still impressed.",2025-04-26T01:07:07,"['gym', 'two', 'floor', 'second', 'floor', 'separate', 'vip', 'section', 'went', 'vip', 'section', 'immediately', 'got', 'smacked', 'face', 'wettest', 'stankiest', 'putrid', 'smell', 'shit', 'wmdlevel', 'proteininduced', 'as', 'permeated', 'entire', 'vip', 'floor', 'teary', 'eyed', 'squinting', 'could', 'see', 'silhouette', '4’10”', 'girl', 'squat', 'rack', 'corner', 'ngl', 'im', 'still', 'impressed']"
Fitness,"It was leg day. I (21F) was two sets in squatting and for the first time in a long long time wearing a tight top and tight bottoms. I also usually don't squat on leg days because of some previous knee injuries but I've been trying to build up my knee strength. Anyway, I decide to take a sip of water and as I do so I kinda look around a little bit and notice that a teen gym bro is on a machine behind me (pretty close behind me as well). He looks a little familiar. Oh, did I mention I'm a student teacher 🫠

Nightmare nightmare nightmare",2025-04-27T14:22:50,"['leg', 'day', '21f', 'two', 'set', 'squatting', 'first', 'time', 'long', 'long', 'time', 'wearing', 'tight', 'top', 'tight', 'bottom', 'also', 'usually', 'dont', 'squat', 'leg', 'day', 'previous', 'knee', 'injury', 'ive', 'trying', 'build', 'knee', 'strength', 'anyway', 'decide', 'take', 'sip', 'water', 'kinda', 'look', 'around', 'little', 'bit', 'notice', 'teen', 'gym', 'bro', 'machine', 'behind', 'pretty', 'close', 'behind', 'well', 'look', 'little', 'familiar', 'oh', 'mention', 'im', 'student', 'teacher', 'nightmare', 'nightmare', 'nightmare']"
Fitness,[removed],2025-04-26T14:55:51,['removed']
Fitness,"My Saturday chain gym finally added a plate-loaded leg press and hack squat.    Such a game changer, not sure why it took literally years for them to do this butI'll take it!",2025-04-26T15:59:35,"['saturday', 'chain', 'gym', 'finally', 'added', 'plateloaded', 'leg', 'press', 'hack', 'squat', 'game', 'changer', 'sure', 'took', 'literally', 'year', 'butill', 'take']"
Fitness,[deleted],2025-04-26T16:43:21,['deleted']
Fitness,"Went up to my gym crush of several months today (I'm male, 31) and just plainly asked for her number. And she gave it to me!!! Just told her then that I will message her later and wished her a good training and went away. Haven't checked if it's the real number yet lol",2025-04-26T07:51:31,"['went', 'gym', 'crush', 'several', 'month', 'today', 'im', 'male', '31', 'plainly', 'asked', 'number', 'gave', 'told', 'message', 'later', 'wished', 'good', 'training', 'went', 'away', 'havent', 'checked', 'real', 'number', 'yet', 'lol']"
Fitness,"I’m about a year into working out. Middle-aged guy, always scrawny around 137 lbs, I’m  eating better and up to 165 lbs. I still look skinny but at least am toned. 

While I was deadlifting had a random guy I often see tell me I should get a lifting belt because “that’s a lot of weight.” He continued saying he saw me at the gym a lot and he admired my “dedication and hard work” while also referencing how much I was lifting on another exercise last week. I don’t think it’s a LOT of weight, but maybe for a guy with my build it is. Felt pretty good!",2025-04-26T17:17:59,"['i’m', 'year', 'working', 'middleaged', 'guy', 'always', 'scrawny', 'around', '137', 'lb', 'i’m', 'eating', 'better', '165', 'lb', 'still', 'look', 'skinny', 'least', 'toned', 'deadlifting', 'random', 'guy', 'often', 'see', 'tell', 'get', 'lifting', 'belt', '“that’s', 'lot', 'weight”', 'continued', 'saying', 'saw', 'gym', 'lot', 'admired', '“dedication', 'hard', 'work”', 'also', 'referencing', 'much', 'lifting', 'another', 'exercise', 'last', 'week', 'don’t', 'think', 'it’s', 'lot', 'weight', 'maybe', 'guy', 'build', 'felt', 'pretty', 'good']"
Fitness,"- For the past two weeks I've been lifting every single day and I never feel sore at all any more
- Sunday will mark my one year anniversary of being back in the gym (stopped when COVID started)
- Finally making (slow) progress on OHP after getting strict about hitting >175g protein a day
- Choked on a sip of water and had a coughing fit while working out next to one of the cutest girls in the gym",2025-04-26T06:00:15,"['past', 'two', 'week', 'ive', 'lifting', 'every', 'single', 'day', 'never', 'feel', 'sore', 'sunday', 'mark', 'one', 'year', 'anniversary', 'back', 'gym', 'stopped', 'covid', 'started', 'finally', 'making', 'slow', 'progress', 'ohp', 'getting', 'strict', 'hitting', '175g', 'protein', 'day', 'choked', 'sip', 'water', 'coughing', 'fit', 'working', 'next', 'one', 'cutest', 'girl', 'gym']"
Fitness,"My gym recently got legit farmers bars, so I've been using them with farmers walks.

It's definitely harder than using dumbbells or kettlebells with the weight being forward and behind you. 

Can't wait to incorporate them into my next training block.",2025-04-26T15:06:46,"['gym', 'recently', 'got', 'legit', 'farmer', 'bar', 'ive', 'using', 'farmer', 'walk', 'definitely', 'harder', 'using', 'dumbbell', 'kettlebells', 'weight', 'forward', 'behind', 'cant', 'wait', 'incorporate', 'next', 'training', 'block']"
Fitness,"I got pinned on a squat despite using the safetys.

I decided to check my 1RM and set the safetys during the warm-up.  I had the right height, but the bar just tapped on them at the bottom.  So I moved them down one more setting.  When I finally missed a squat, I was stuck under the bar. I squat to full depth, so I didn't have the ability to just drop further.  It took me a while to figure out how to work myself from under the bar.

Lesson learned.",2025-04-26T13:04:03,"['got', 'pinned', 'squat', 'despite', 'using', 'safety', 'decided', 'check', '1rm', 'set', 'safety', 'warmup', 'right', 'height', 'bar', 'tapped', 'bottom', 'moved', 'one', 'setting', 'finally', 'missed', 'squat', 'stuck', 'bar', 'squat', 'full', 'depth', 'didnt', 'ability', 'drop', 'took', 'figure', 'work', 'bar', 'lesson', 'learned']"
Fitness,"I joined a new gym about eight months ago.
Before that, I’d been going to several other gyms over the years — one for a bit over two years, and the rest for a few months or with day passes while I was moving around. So I’ve been lifting consistently for quite a while.

A few weeks ago, a trainer came up to me in the middle of my set and told me that some members had complained about my sweaty smell.
Now, I know no one smells like flowers and rainbows while working out, but I always wear freshly washed clothes, prep before the gym, and use deodorant.
In all my years of training, no one has ever said anything like that to me. I even asked former gym buddies and people I used to run with in the middle of summer, and they all said I smell completely normal.

I don’t want to assume the worst, but I’m starting to feel like this might be a racist thing.
I’m a foreigner living in a small village, and at this gym, I’m one of the very few people who lift seriously. Most of the members are older and go more for general mobility than weight training.
It kind of feels like they see me as “too much” and just want me gone.

Now I’m considering switching gyms, but the next closest one is in another village, and I’d have to drive there every time — which isn’t ideal.

Has anyone else experienced something like this?",2025-04-29T06:42:54,"['joined', 'new', 'gym', 'eight', 'month', 'ago', 'i’d', 'going', 'several', 'gym', 'year', '—', 'one', 'bit', 'two', 'year', 'rest', 'month', 'day', 'pass', 'moving', 'around', 'i’ve', 'lifting', 'consistently', 'quite', 'week', 'ago', 'trainer', 'came', 'middle', 'set', 'told', 'member', 'complained', 'sweaty', 'smell', 'know', 'one', 'smell', 'like', 'flower', 'rainbow', 'working', 'always', 'wear', 'freshly', 'washed', 'clothes', 'prep', 'gym', 'use', 'deodorant', 'year', 'training', 'one', 'ever', 'said', 'anything', 'like', 'even', 'asked', 'former', 'gym', 'buddy', 'people', 'used', 'run', 'middle', 'summer', 'said', 'smell', 'completely', 'normal', 'don’t', 'want', 'assume', 'worst', 'i’m', 'starting', 'feel', 'like', 'might', 'racist', 'thing', 'i’m', 'foreigner', 'living', 'small', 'village', 'gym', 'i’m', 'one', 'people', 'lift', 'seriously', 'member', 'older', 'go', 'general', 'mobility', 'weight', 'training', 'kind', 'feel', 'like', 'see', '“too', 'much”', 'want', 'gone', 'i’m', 'considering', 'switching', 'gym', 'next', 'closest', 'one', 'another', 'village', 'i’d', 'drive', 'every', 'time', '—', 'isn’t', 'ideal', 'anyone', 'else', 'experienced', 'something', 'like']"
Fitness,"I was at my tiny gym with only a yoga strength older lady using it. We were doing very similar exercises and I found her breathing/meditation between sets to be fascinating. 


I also moved up to 40kg on hamstring from 30, when doing 3x10s. I'm finding the last 2-3 reps to be challenging. It's nice to see change over the last 6 weeks (I only get out once a week). 


Also surprised the weight is so low, I have big thigs so figured my quads would be stronger. ",2025-04-26T15:13:59,"['tiny', 'gym', 'yoga', 'strength', 'older', 'lady', 'using', 'similar', 'exercise', 'found', 'breathingmeditation', 'set', 'fascinating', 'also', 'moved', '40kg', 'hamstring', '30', '3x10s', 'im', 'finding', 'last', '23', 'rep', 'challenging', 'nice', 'see', 'change', 'last', '6', 'week', 'get', 'week', 'also', 'surprised', 'weight', 'low', 'big', 'thigs', 'figured', 'quad', 'would', 'stronger']"
Fitness,"Woke up at 7 AM, not really hyped but figured I’d go anyway.
Got to the gym, saw a few folks already grinding hard (it’s Saturday, people don’t joke).
Did a quick warm-up, then tried to get through my sets without dying.
My body was like “nah, let’s chill,” but my mind pushed a bit more.
Music in my ears helped a lot — keeps me going even when I wanna stop.
Saturday’s not about smashing records, just about showing up.",2025-04-27T00:19:22,"['woke', '7', 'really', 'hyped', 'figured', 'i’d', 'go', 'anyway', 'got', 'gym', 'saw', 'folk', 'already', 'grinding', 'hard', 'it’s', 'saturday', 'people', 'don’t', 'joke', 'quick', 'warmup', 'tried', 'get', 'set', 'without', 'dying', 'body', 'like', '“nah', 'let’s', 'chill”', 'mind', 'pushed', 'bit', 'music', 'ear', 'helped', 'lot', '—', 'keep', 'going', 'even', 'wanna', 'stop', 'saturday’s', 'smashing', 'record', 'showing']"
Fitness,"This week I achieved something that’s often underrated:
After constantly pushing and progressing since Covid, I finally listened to my body asking for real rest.
Taking a step back now, so next week I can push for +10%!",2025-04-27T20:10:41,"['week', 'achieved', 'something', 'that’s', 'often', 'underrated', 'constantly', 'pushing', 'progressing', 'since', 'covid', 'finally', 'listened', 'body', 'asking', 'real', 'rest', 'taking', 'step', 'back', 'next', 'week', 'push', '10']"
Fitness,"I *never* go to the gym on the weekends, but after going too ham on Easter, Monday a non-starter (I didn't sleep from having acid reflux) and I didn't want to skip a day. 

So, that changed today.

Why the fuck do so many people bring their young, sticky, gross children to the gym on Saturdays? My gym does not have a daycare. These children are legally unable to hold memberships. Why are they here *touching fucking everything*? Why is there, what appears to be an 8 year old in the men's change room?

Why the fuck am I being exposed to this? 

I actually hate my gym more than I did before, which is a pretty difficult task since I absolutely *loathe* my gym with every fibre of my being. Between the dog-shit machine selection, single set of bumper plates for the entire gym to share, absurd membership fee, and functionally subsidizing a pool I will never use because public pools are fucking gross, I'm literally trying to figure out if I can afford a new house with a garage so I can put a gym in it.

For those of you wondering why I don't go to another gym: I live in a little podunk town and the next closest gym is a ~22 min commute. The fuel cost alone would make it more expensive and require 40 more minutes of my life every day to go since I work from home, so that's a total non-starter.

Anyway, this is a long borderline rant to say some kid literally touched me with a sucker and that is not fucking okay.",2025-04-26T19:32:15,"['never', 'go', 'gym', 'weekend', 'going', 'ham', 'easter', 'monday', 'nonstarter', 'didnt', 'sleep', 'acid', 'reflux', 'didnt', 'want', 'skip', 'day', 'changed', 'today', 'fuck', 'many', 'people', 'bring', 'young', 'sticky', 'gross', 'child', 'gym', 'saturday', 'gym', 'daycare', 'child', 'legally', 'unable', 'hold', 'membership', 'touching', 'fucking', 'everything', 'appears', '8', 'year', 'old', 'men', 'change', 'room', 'fuck', 'exposed', 'actually', 'hate', 'gym', 'pretty', 'difficult', 'task', 'since', 'absolutely', 'loathe', 'gym', 'every', 'fibre', 'dogshit', 'machine', 'selection', 'single', 'set', 'bumper', 'plate', 'entire', 'gym', 'share', 'absurd', 'membership', 'fee', 'functionally', 'subsidizing', 'pool', 'never', 'use', 'public', 'pool', 'fucking', 'gross', 'im', 'literally', 'trying', 'figure', 'afford', 'new', 'house', 'garage', 'put', 'gym', 'wondering', 'dont', 'go', 'another', 'gym', 'live', 'little', 'podunk', 'town', 'next', 'closest', 'gym', '22', 'min', 'commute', 'fuel', 'cost', 'alone', 'would', 'make', 'expensive', 'require', '40', 'minute', 'life', 'every', 'day', 'go', 'since', 'work', 'home', 'thats', 'total', 'nonstarter', 'anyway', 'long', 'borderline', 'rant', 'say', 'kid', 'literally', 'touched', 'sucker', 'fucking', 'okay']"
Fitness,"Joined the gym recently at 32. It's crazy how much more stamina and how much heavier I used to lift after breaks from the gym in my early 20s. My current maxes are \~80% what I used to do comfortably at reps at 23. Used to comfortably do 1 hour of stairmaster / 5000+ steps / 220+ floors at my physical peak. 

Now I can do at most 45 mins / \~3000 steps / \~140 floors. 

Eating a lot healthier now so starting to see more aesthetic changes already 1-2 months in (tricep definition and narrow hip due to 4x stairmaster sessions a week). I dirty bulked in my early 20s, trying to be more consciousness this time around.",2025-04-29T02:13:34,"['joined', 'gym', 'recently', '32', 'crazy', 'much', 'stamen', 'much', 'heavier', 'used', 'lift', 'break', 'gym', 'early', '20', 'current', 'max', '80', 'used', 'comfortably', 'rep', '23', 'used', 'comfortably', '1', 'hour', 'stairmaster', '5000', 'step', '220', 'floor', 'physical', 'peak', '45', 'min', '3000', 'step', '140', 'floor', 'eating', 'lot', 'healthier', 'starting', 'see', 'aesthetic', 'change', 'already', '12', 'month', 'tricep', 'definition', 'narrow', 'hip', 'due', '4x', 'stairmaster', 'session', 'week', 'dirty', 'bulked', 'early', '20', 'trying', 'consciousness', 'time', 'around']"
Fitness,"I finally understand why rest is important rather than going fucking HAM 24/7.  Been working out for about a year at a chill intensity.  Last week I started going HAM.  Meaning if I’m experiencing insomnia, I just do push-ups n squats all night.  Did that Thursday night.  Then on Friday decided that I was gonna dive to “Mariana’s trench” via axe swinging.  Did that for an hour.  Then came inside and ate some food.  

Then I was like fuck, gotta hit legs.  Hit legs and then I felt it…. My body said “you’re fuckin done, and if you keep pushing, I’ll make you faint”

Then I laid on my couch and passed tf out for about 12 hrs.  Everything is sore.  It wasn’t sore until I woke up.  But it feels good, like im making progress.  Will continue to push then rest when my body tells me to lol",2025-04-26T22:25:48,"['finally', 'understand', 'rest', 'important', 'rather', 'going', 'fucking', 'ham', '247', 'working', 'year', 'chill', 'intensity', 'last', 'week', 'started', 'going', 'ham', 'meaning', 'i’m', 'experiencing', 'insomnia', 'pushup', 'n', 'squat', 'night', 'thursday', 'night', 'friday', 'decided', 'gonna', 'dive', '“mariana’s', 'trench”', 'via', 'axe', 'swinging', 'hour', 'came', 'inside', 'ate', 'food', 'like', 'fuck', 'gotta', 'hit', 'leg', 'hit', 'leg', 'felt', 'it…', 'body', 'said', '“you’re', 'fuckin', 'done', 'keep', 'pushing', 'i’ll', 'make', 'faint”', 'laid', 'couch', 'passed', 'tf', '12', 'hr', 'everything', 'sore', 'wasn’t', 'sore', 'woke', 'feel', 'good', 'like', 'im', 'making', 'progress', 'continue', 'push', 'rest', 'body', 'tell', 'lol']"
Fitness,How far are you willing to travel for a gym?  I'm finding myself getting annoyed too often at my current gym and the other local place is pretty run down.,2025-04-27T05:19:50,"['far', 'willing', 'travel', 'gym', 'im', 'finding', 'getting', 'annoyed', 'often', 'current', 'gym', 'local', 'place', 'pretty', 'run']"
Fitness,[deleted],2025-04-27T11:09:55,['deleted']
Fitness,"Benched 150kg today. With a decent pause and no help. Then bunch of great people working as personal trainers in the gym, thinking I'm listening to loud music in my earbuds as always, immediately started talking things like ""if I was as heavy as he is I would bench 180 for reps"" ""he'll ruin his joints soon"" ""I'm using a very narrow grip I think that's better if I benched with a wider grip that would be far easier"" ""it's all ego"" and stuff

Why? Why all the negativity? Of all people your job is to train people to help them achieve their goals, the exact opposite of this.

I walked towards them to join the convo and maybe say one or two things but they all walked away. Sad.",2025-04-30T16:26:13,"['benched', '150kg', 'today', 'decent', 'pause', 'help', 'bunch', 'great', 'people', 'working', 'personal', 'trainer', 'gym', 'thinking', 'im', 'listening', 'loud', 'music', 'earbuds', 'always', 'immediately', 'started', 'talking', 'thing', 'like', 'heavy', 'would', 'bench', '180', 'rep', 'hell', 'ruin', 'joint', 'soon', 'im', 'using', 'narrow', 'grip', 'think', 'thats', 'better', 'benched', 'wider', 'grip', 'would', 'far', 'easier', 'ego', 'stuff', 'negativity', 'people', 'job', 'train', 'people', 'help', 'achieve', 'goal', 'exact', 'opposite', 'walked', 'towards', 'join', 'convo', 'maybe', 'say', 'one', 'two', 'thing', 'walked', 'away', 'sad']"
Fitness,"Two things: people with no gym etiquette! Re-rack your friggin weights 🤬

My personal hell: When you have a day when everything thing feels heavier than usual, but the following week, you’re back to normal. Weights, stop playing with my emotions 😅",2025-04-30T09:08:22,"['two', 'thing', 'people', 'gym', 'etiquette', 'rerack', 'friggin', 'weight', 'personal', 'hell', 'day', 'everything', 'thing', 'feel', 'heavier', 'usual', 'following', 'week', 'you’re', 'back', 'normal', 'weight', 'stop', 'playing', 'emotion']"
Fitness,Not the summer body people invading my gym I thought the planet fitness that opened nearby would've poached those people but alas.,2025-04-30T12:18:47,"['summer', 'body', 'people', 'invading', 'gym', 'thought', 'planet', 'fitness', 'opened', 'nearby', 'wouldve', 'poached', 'people', 'ala']"
Fitness,"I've had a rough day and in the middle of that rough day and a migraine I decided to go to the gym because I haven't gone to the gym ever since coming back from a trip (illness/fatigue) but there's this girl who always... ALWAYS sings at the top of her lungs when she's working out. She has headphones on and she pretends not to see anyone else except her boyfriend at the gym. 

I had enough sense to leave because if I stayed it would've ended in a fight.",2025-04-30T13:52:18,"['ive', 'rough', 'day', 'middle', 'rough', 'day', 'migraine', 'decided', 'go', 'gym', 'havent', 'gone', 'gym', 'ever', 'since', 'coming', 'back', 'trip', 'illnessfatigue', 'there', 'girl', 'always', 'always', 'sings', 'top', 'lung', 'shes', 'working', 'headphone', 'pretend', 'see', 'anyone', 'else', 'except', 'boyfriend', 'gym', 'enough', 'sense', 'leave', 'stayed', 'wouldve', 'ended', 'fight']"
Fitness,"I had a delicious Korean fried chicken sandwich yesterday. The problem was I had it just before going to the gym. I was burping nasty kimchee burps the whole time, and while my lifts were fine, cardio was hell. ",2025-04-30T14:42:21,"['delicious', 'korean', 'fried', 'chicken', 'sandwich', 'yesterday', 'problem', 'going', 'gym', 'burping', 'nasty', 'kimchee', 'burp', 'whole', 'time', 'lift', 'fine', 'cardio', 'hell']"
