subreddit,text,fecha,tokens
Fitness,"I've struggled with my weight nearly all my life.  Then through most of my 20s and 30s I couldn't (wouldn't) be consistent with exercise.  Now I've finally found that exercise consistency for the past few years, which is great.  The diet still isn't there yet, though.  Just a terrible relationship with food.

I say all that to say this:  I've hit most of my personal strength milestones.  Five plate squat and deadlift.  I can do a few chinups or pullups.  The only thing I'm missing is the three plate bench.  At the beginning of the year I told myself I'd really focus on cleaning up my diet once I hit that milestone (the whole ""mass moves mass"" thing).  Been stuck at 300lbs ever since.  

Tried 315 a week after hitting 300 just to YOLO it and got stapled.  Picked up a semi-unrelated shoulder issue in March.  If I don't at least up my PR by the Garage Gym Competition coming up, I'm afraid I might just have to call it and accept that its not going to happen.

Suppose this is more of a vent than a rant, but I'm just really bummed about this one.",2025-04-30T22:51:01,"['ive', 'struggled', 'weight', 'nearly', 'life', '20', '30', 'couldnt', 'wouldnt', 'consistent', 'exercise', 'ive', 'finally', 'found', 'exercise', 'consistency', 'past', 'year', 'great', 'diet', 'still', 'isnt', 'yet', 'though', 'terrible', 'relationship', 'food', 'say', 'say', 'ive', 'hit', 'personal', 'strength', 'milestone', 'five', 'plate', 'squat', 'deadlift', 'chinups', 'pullups', 'thing', 'im', 'missing', 'three', 'plate', 'bench', 'beginning', 'year', 'told', 'id', 'really', 'focus', 'cleaning', 'diet', 'hit', 'milestone', 'whole', 'mass', 'move', 'mass', 'thing', 'stuck', '300lbs', 'ever', 'since', 'tried', '315', 'week', 'hitting', '300', 'yolo', 'got', 'stapled', 'picked', 'semiunrelated', 'shoulder', 'issue', 'march', 'dont', 'least', 'pr', 'garage', 'gym', 'competition', 'coming', 'im', 'afraid', 'might', 'call', 'accept', 'going', 'happen', 'suppose', 'vent', 'rant', 'im', 'really', 'bummed', 'one']"
Fitness,"Been lifting 3-5 days a week running 4-2 days a week, since October 2024. Getting stronger and faster. Still fat! 5’10”    210- > 190//195",2025-05-01T00:44:43,"['lifting', '35', 'day', 'week', 'running', '42', 'day', 'week', 'since', 'october', '2024', 'getting', 'stronger', 'faster', 'still', 'fat', '5’10”', '210', '190195']"
Fitness,"If you see me doing weighted walking lunges, ***DO NOT SIT DOWN RIGHT IN MY WALKING PATH.***",2025-04-30T12:43:59,"['see', 'weighted', 'walking', 'lunge', 'sit', 'right', 'walking', 'path']"
Fitness,"Down 40 pounds, at 13% body fat and I’m plateauing with my weight loss, just wanna see my abs dawg 😭",2025-04-30T17:56:57,"['40', 'pound', '13', 'body', 'fat', 'i’m', 'plateauing', 'weight', 'loss', 'wanna', 'see', 'ab', 'dawg']"
Fitness,"I was on vacation in San Diego. I was originally going to use those days as rest days to nurse a nagging shoulder. 

But on day two I couldn't take it and looked for a local gym. 

After reviewing a dozen gyms online, all with photos of women on yoga mats, photos of the view surrounding the building, ""wellness"" promoted everywhere, I finally came across a gym named War House. 

I bought the day pass and hit the gym. 

This gym was amazing, nothing like it around my area. The vibe was on point. The equipment was amazing, especially the handcrafted pieces. It was just amazing. 

It was so awesome, I went back the day I was leaving because I just had to go again. 

Now that I'm back home, my normal gym just doesn't hit the same as War House. Back to waiting for equipment being used by 80 year old men and women doing their 0 ROM thing they do. 

I know I know, I'm suppose to be happy and supportive, and really, good for them,  but damnit I got shit to do and they ain't doing shit. 

All that being said, fuck I miss that gym. Mine just ain't the same anymore after that experience.",2025-04-30T09:46:30,"['vacation', 'san', 'diego', 'originally', 'going', 'use', 'day', 'rest', 'day', 'nurse', 'nagging', 'shoulder', 'day', 'two', 'couldnt', 'take', 'looked', 'local', 'gym', 'reviewing', 'dozen', 'gym', 'online', 'photo', 'woman', 'yoga', 'mat', 'photo', 'view', 'surrounding', 'building', 'wellness', 'promoted', 'everywhere', 'finally', 'came', 'across', 'gym', 'named', 'war', 'house', 'bought', 'day', 'pas', 'hit', 'gym', 'gym', 'amazing', 'nothing', 'like', 'around', 'area', 'vibe', 'point', 'equipment', 'amazing', 'especially', 'handcrafted', 'piece', 'amazing', 'awesome', 'went', 'back', 'day', 'leaving', 'go', 'im', 'back', 'home', 'normal', 'gym', 'doesnt', 'hit', 'war', 'house', 'back', 'waiting', 'equipment', 'used', '80', 'year', 'old', 'men', 'woman', '0', 'rom', 'thing', 'know', 'know', 'im', 'suppose', 'happy', 'supportive', 'really', 'good', 'damnit', 'got', 'shit', 'aint', 'shit', 'said', 'fuck', 'miss', 'gym', 'mine', 'aint', 'anymore', 'experience']"
Fitness,"Last week I finally got back to a 3 plate bench after a lingering trap injury. Yay, milestone crossed on the way back. Today, nope it wasn't happening. Frustrating when progress is so stuttered.",2025-04-30T23:31:00,"['last', 'week', 'finally', 'got', 'back', '3', 'plate', 'bench', 'lingering', 'trap', 'injury', 'yay', 'milestone', 'crossed', 'way', 'back', 'today', 'nope', 'wasnt', 'happening', 'frustrating', 'progress', 'stuttered']"
Fitness,"I just can’t with people who complain abt their workouts sucking or they’re making slow progress and what have you, who also refuse to lock in their training, nutrition, n sleep. 
Also when all the old dudes in the gym give me death stares for doing a set of 3-6 reps",2025-04-30T09:29:23,"['can’t', 'people', 'complain', 'abt', 'workout', 'sucking', 'they’re', 'making', 'slow', 'progress', 'also', 'refuse', 'lock', 'training', 'nutrition', 'n', 'sleep', 'also', 'old', 'dude', 'gym', 'give', 'death', 'stare', 'set', '36', 'rep']"
Fitness,"All this week I've been planning to go to gym but every time I stood up and went to the gym, there was always something pulled me back, which were, my colleagues ask me to go back to office 'cause there was something amiss with the work. I am literally screaming!!!!",2025-04-30T13:39:48,"['week', 'ive', 'planning', 'go', 'gym', 'every', 'time', 'stood', 'went', 'gym', 'always', 'something', 'pulled', 'back', 'colleague', 'ask', 'go', 'back', 'office', 'cause', 'something', 'amiss', 'work', 'literally', 'screaming']"
Fitness,"Fuck you to who ever took my cables while I was between sets of cable crossovers. I was even standing right there. Didn’t give me a chance to finish my second set. Didn’t apologize. Went to go find another pair of cables so I could start my second set and of course they’re all being used. And this is the second time this has happened.

I’m thinking I need to learn to be more assertive without being a bitch. 

Another fuck you to the guy who always hogs a pair of them for his ENTIRE workout. 30 mins tops even when it’s busy.

And ANOTHER fuck you to people who still refuse to re rack their weight plates. I’m fucking tired of cleaning up after you.",2025-04-30T20:12:20,"['fuck', 'ever', 'took', 'cable', 'set', 'cable', 'crossover', 'even', 'standing', 'right', 'didn’t', 'give', 'chance', 'finish', 'second', 'set', 'didn’t', 'apologize', 'went', 'go', 'find', 'another', 'pair', 'cable', 'could', 'start', 'second', 'set', 'course', 'they’re', 'used', 'second', 'time', 'happened', 'i’m', 'thinking', 'need', 'learn', 'assertive', 'without', 'bitch', 'another', 'fuck', 'guy', 'always', 'hog', 'pair', 'entire', 'workout', '30', 'min', 'top', 'even', 'it’s', 'busy', 'another', 'fuck', 'people', 'still', 'refuse', 'rack', 'weight', 'plate', 'i’m', 'fucking', 'tired', 'cleaning']"
Fitness,"I've said I want to get jacked so I can finally get a sleeve but that's a lie

I've said I want to get jacked so I can finally be desired by women, but that's not the whole truth (and they lie too)

I've said I want to get jacked so no one makes me feel weak again, but for that I drive to the therapist's office not the gym

I want to get jacked so I can finally earn the right post this meme, and look like I do: https://i.pinimg.com/736x/62/60/49/6260497edd9049771fd9837fc3eb8d58.jpg",2025-04-30T17:07:30,"['ive', 'said', 'want', 'get', 'jacked', 'finally', 'get', 'sleeve', 'thats', 'lie', 'ive', 'said', 'want', 'get', 'jacked', 'finally', 'desired', 'woman', 'thats', 'whole', 'truth', 'lie', 'ive', 'said', 'want', 'get', 'jacked', 'one', 'make', 'feel', 'weak', 'drive', 'therapist', 'office', 'gym', 'want', 'get', 'jacked', 'finally', 'earn', 'right', 'post', 'meme', 'look', 'like']"
Fitness,Bicep heal slow.,2025-04-30T19:16:24,"['bicep', 'heal', 'slow']"
Fitness,[deleted],2025-04-30T21:29:06,['deleted']
Fitness," 25 M -I had been working towards a body recomp steadily over the years with some on and off.  I started around 200 lbs in 2020. Last december I started a diet of 1200 calories a day with 1 or 2 cheat days a week but still getting results as I do 10-20000 steps daily and lots of strength training, but I messed up past 2-3 weeks due to a wrist injury. Depressed I dropped my intake to 900 with no cheat days and 25,000 steps daily.  Whilst I'm at 150 lbs now and I've never had a more chiseled face,  I've noticed sagging stomach fat. What should I do to tighten it? I don't want to bulk and gain facial fat again. I've never been this happier and worried at the same time.",2025-05-01T04:33:38,"['25', 'working', 'towards', 'body', 'recomp', 'steadily', 'year', 'started', 'around', '200', 'lb', '2020', 'last', 'december', 'started', 'diet', '1200', 'calorie', 'day', '1', '2', 'cheat', 'day', 'week', 'still', 'getting', 'result', '1020000', 'step', 'daily', 'lot', 'strength', 'training', 'messed', 'past', '23', 'week', 'due', 'wrist', 'injury', 'depressed', 'dropped', 'intake', '900', 'cheat', 'day', '25000', 'step', 'daily', 'whilst', 'im', '150', 'lb', 'ive', 'never', 'chiseled', 'face', 'ive', 'noticed', 'sagging', 'stomach', 'fat', 'tighten', 'dont', 'want', 'bulk', 'gain', 'facial', 'fat', 'ive', 'never', 'happier', 'worried', 'time']"
Fitness,"I finally used a bench in the main room of my gym to do my triceps and biceps, instead of hiding in the small side room.😂",2025-04-27T11:24:18,"['finally', 'used', 'bench', 'main', 'room', 'gym', 'triceps', 'biceps', 'instead', 'hiding', 'small', 'side', 'room']"
Fitness,"I got my first gym compliment. I did ten strict pull-ups, not much but one of the regulars I've never spoken to called me over and told me he thought it was incredible. It kinda made me want to try and work towards doing a muscle up. I guess that's the next goal.",2025-04-27T15:41:23,"['got', 'first', 'gym', 'compliment', 'ten', 'strict', 'pullups', 'much', 'one', 'regular', 'ive', 'never', 'spoken', 'called', 'told', 'thought', 'incredible', 'kinda', 'made', 'want', 'try', 'work', 'towards', 'muscle', 'guess', 'thats', 'next', 'goal']"
Fitness,"I walked my first half marathon yesterday! I held a 14:10/mile pace and finished in 3 hours and 8 minutes. I usually walk a pace of 14:30-15:30/mile so I’m really proud of myself for being able to set a personal best, but goddamn it I am sore today.",2025-04-27T16:45:36,"['walked', 'first', 'half', 'marathon', 'yesterday', 'held', '1410mile', 'pace', 'finished', '3', 'hour', '8', 'minute', 'usually', 'walk', 'pace', '14301530mile', 'i’m', 'really', 'proud', 'able', 'set', 'personal', 'best', 'goddamn', 'sore', 'today']"
Fitness,"I ran a 10k today without pain. It wasn't fast or anything, but doing it without my hips, left knee or ankle hurting felt great. I have been doing single leg push exercises lately, and I think that's what's been paying off today.",2025-04-27T10:32:13,"['ran', '10k', 'today', 'without', 'pain', 'wasnt', 'fast', 'anything', 'without', 'hip', 'left', 'knee', 'ankle', 'hurting', 'felt', 'great', 'single', 'leg', 'push', 'exercise', 'lately', 'think', 'thats', 'whats', 'paying', 'today']"
Fitness,"I’m continuing to progress well in squats. I hit the 3rd heaviest squat I’ve ever done and I did it for 4 reps, with multiple reps still left in the tank! 

460lbs for 4: https://www.reddit.com/r/strength_training/s/DkNoFINyk5",2025-04-27T11:05:06,"['i’m', 'continuing', 'progress', 'well', 'squat', 'hit', '3rd', 'heaviest', 'squat', 'i’ve', 'ever', 'done', '4', 'rep', 'multiple', 'rep', 'still', 'left', 'tank', '460lbs', '4']"
Fitness,"Joined the 1000 pound club! I wasn't chasing it specifically, just added up my numbers a few weeks ago and saw that I was close. 

I shall reward myself with a T-shirt.",2025-04-27T16:23:04,"['joined', '1000', 'pound', 'club', 'wasnt', 'chasing', 'specifically', 'added', 'number', 'week', 'ago', 'saw', 'close', 'shall', 'reward', 'tshirt']"
Fitness,I noticed my scale has been acting weird the last week or so. Today I realized it's because I'm down to a weight where it gets me confused with another member of the household.,2025-04-27T17:53:32,"['noticed', 'scale', 'acting', 'weird', 'last', 'week', 'today', 'realized', 'im', 'weight', 'get', 'confused', 'another', 'member', 'household']"
Fitness,"Did my first powerlifting meet. Squat: 408, bench 267 (scratched on 277), deadlift: 475. Body weight: 198. Total: 1150",2025-04-27T20:23:27,"['first', 'powerlifting', 'meet', 'squat', '408', 'bench', '267', 'scratched', '277', 'deadlift', '475', 'body', 'weight', '198', 'total', '1150']"
Fitness,I've slept like shit all week and managed to do okay-ish in the gym.,2025-04-27T15:20:29,"['ive', 'slept', 'like', 'shit', 'week', 'managed', 'okayish', 'gym']"
Fitness,I am once again able to do dumbbell lat raises at 15 pounds on each side for reps for the first time in almost a year. The right shoulder girdle is at about 85-90 percent and I figure I'll be able to start benching heavy and making a run at my all time PR in about 2-3 months.,2025-04-27T10:17:01,"['able', 'dumbbell', 'lat', 'raise', '15', 'pound', 'side', 'rep', 'first', 'time', 'almost', 'year', 'right', 'shoulder', 'girdle', '8590', 'percent', 'figure', 'ill', 'able', 'start', 'benching', 'heavy', 'making', 'run', 'time', 'pr', '23', 'month']"
Fitness,"29 consecutive weeks of getting to the gym at least 4 times per week. This week was a challenge with real life getting in the way, but I just made it, despite really not feeling like going a couple of times.

Discipline > Motivation",2025-04-28T01:14:52,"['29', 'consecutive', 'week', 'getting', 'gym', 'least', '4', 'time', 'per', 'week', 'week', 'challenge', 'real', 'life', 'getting', 'way', 'made', 'despite', 'really', 'feeling', 'like', 'going', 'couple', 'time', 'discipline', 'motivation']"
Fitness,"After over 10 years in the gym, I got my first compliment from a female gym goer. A trainer at one of the gyms I go to asked if I was a powelifter.  Which may sound flattering but there are a few caveats to this compliment.  First, she is a bodybuilding coach, so she doesn't understand I am nowhere near powerlifting standards for strength.  Second, she is a body building coach who did not mistake me for a body builder.  Not that I train for size, but it would have been nice.  Either way, I shall accept this very small and incorrect compliment.",2025-04-27T12:08:28,"['10', 'year', 'gym', 'got', 'first', 'compliment', 'female', 'gym', 'goer', 'trainer', 'one', 'gym', 'go', 'asked', 'powelifter', 'may', 'sound', 'flattering', 'caveat', 'compliment', 'first', 'bodybuilding', 'coach', 'doesnt', 'understand', 'nowhere', 'near', 'powerlifting', 'standard', 'strength', 'second', 'body', 'building', 'coach', 'mistake', 'body', 'builder', 'train', 'size', 'would', 'nice', 'either', 'way', 'shall', 'accept', 'small', 'incorrect', 'compliment']"
Fitness,"Ran a 1:33 at my local half marathon this weekend, which was a big PR for me. I haven’t been in the weight room as much as I’d like these last couple of years. I’m hoping to shift my emphasis to 5k/mile focused training and spend more time in the gym in this upcoming training block. I won’t be knocking down any lifetime PRs anytime soon, but it would be nice to throw some heavier weights around again while maintaining my speed/aerobic fitness.",2025-04-27T14:45:24,"['ran', '133', 'local', 'half', 'marathon', 'weekend', 'big', 'pr', 'haven’t', 'weight', 'room', 'much', 'i’d', 'like', 'last', 'couple', 'year', 'i’m', 'hoping', 'shift', 'emphasis', '5kmile', 'focused', 'training', 'spend', 'time', 'gym', 'upcoming', 'training', 'block', 'won’t', 'knocking', 'lifetime', 'pr', 'anytime', 'soon', 'would', 'nice', 'throw', 'heavier', 'weight', 'around', 'maintaining', 'speedaerobic', 'fitness']"
Fitness,"Oh my gosh. I just pulled on a pair of skinny jeans I haven't worn since college, back when I was starving myself and 30 lbs lighter. Not only do they fit, but they're loose.

Also: I can't fit my arms through the holes in my old blouses lol.",2025-04-27T15:40:24,"['oh', 'gosh', 'pulled', 'pair', 'skinny', 'jean', 'havent', 'worn', 'since', 'college', 'back', 'starving', '30', 'lb', 'lighter', 'fit', 'theyre', 'loose', 'also', 'cant', 'fit', 'arm', 'hole', 'old', 'blouse', 'lol']"
Fitness,"Had a pleasant conversation with a relatively new (to me) member at my gym. We talked for like 10 minutes. As someone who never gets approached, this was a victory for me. It felt really nice (: hopefully I’ll see them again this week.",2025-04-27T16:38:56,"['pleasant', 'conversation', 'relatively', 'new', 'member', 'gym', 'talked', 'like', '10', 'minute', 'someone', 'never', 'get', 'approached', 'victory', 'felt', 'really', 'nice', 'hopefully', 'i’ll', 'see', 'week']"
Fitness,On a business trip overseas and got out and ran my usual 4+ miles around a nice lake in the area.  A bit cold and breezy but worth getting out.,2025-04-27T11:52:19,"['business', 'trip', 'overseas', 'got', 'ran', 'usual', '4', 'mile', 'around', 'nice', 'lake', 'area', 'bit', 'cold', 'breezy', 'worth', 'getting']"
Fitness,"Going into the last week of my current run through SBS RTF with hypertrophy progression for accessories. And was just looking at how my TMs had changed while prepping a new spreadsheet.

Squat has gone from 100kg to 112 which, given I was being really conservative with Amrap sets due to a doggy knee, I’m ok with. OHP has gone from 42.5 -> 51. Deadlift has gone from 115 -> 137.

Bench, on the other hand has only gone from 75kg to 79. Though given that starting TM was based off  a sketchy single I did on my rest week before starting, and given I’ve lost around 7kg across the program I’m not gonna lose too much sleep over that.

I’ve also started going bodyweight chins and dips which I’ve never been able to do before. So calling that a successful run through.",2025-04-27T12:04:12,"['going', 'last', 'week', 'current', 'run', 'sb', 'rtf', 'hypertrophy', 'progression', 'accessory', 'looking', 'tm', 'changed', 'prepping', 'new', 'spreadsheet', 'squat', 'gone', '100kg', '112', 'given', 'really', 'conservative', 'amrap', 'set', 'due', 'doggy', 'knee', 'i’m', 'ok', 'ohp', 'gone', '425', '51', 'deadlift', 'gone', '115', '137', 'bench', 'hand', 'gone', '75kg', '79', 'though', 'given', 'starting', 'tm', 'based', 'sketchy', 'single', 'rest', 'week', 'starting', 'given', 'i’ve', 'lost', 'around', '7kg', 'across', 'program', 'i’m', 'gonna', 'lose', 'much', 'sleep', 'i’ve', 'also', 'started', 'going', 'bodyweight', 'chin', 'dip', 'i’ve', 'never', 'able', 'calling', 'successful', 'run']"
Fitness,Last week I hit 230 lb bench PR and this week I hit 235 lbs. Going to ride the high and try for 240 this week.,2025-04-27T16:37:32,"['last', 'week', 'hit', '230', 'lb', 'bench', 'pr', 'week', 'hit', '235', 'lb', 'going', 'ride', 'high', 'try', '240', 'week']"
Fitness,"11 weeks straight without missing a day. I also successfully swapped all sweets for fruit this past week which has really helped me stay under cals while still getting plenty of protein. Every time my diet or routine has failed in the past it's been due to binging on sweets, so if I can learn to love fruit instead that should make this so much easier. I feel locked the fuck in. ",2025-04-27T19:27:35,"['11', 'week', 'straight', 'without', 'missing', 'day', 'also', 'successfully', 'swapped', 'sweet', 'fruit', 'past', 'week', 'really', 'helped', 'stay', 'cals', 'still', 'getting', 'plenty', 'protein', 'every', 'time', 'diet', 'routine', 'failed', 'past', 'due', 'binging', 'sweet', 'learn', 'love', 'fruit', 'instead', 'make', 'much', 'easier', 'feel', 'locked', 'fuck']"
Fitness,"Last Tuesday was 365 days without a rest day.

I don't know what got me into not doing rest days, but I don't. I do some light days, and I do deload weeks regularly. That works for me.",2025-04-28T03:30:18,"['last', 'tuesday', '365', 'day', 'without', 'rest', 'day', 'dont', 'know', 'got', 'rest', 'day', 'dont', 'light', 'day', 'deload', 'week', 'regularly', 'work']"
Fitness,"The rest of my life might be collapsing in on itself but I've been under 200lb for the last two weeks for the first time in 20 years, basically since I was a teenager.",2025-04-28T12:13:47,"['rest', 'life', 'might', 'collapsing', 'ive', '200lb', 'last', 'two', 'week', 'first', 'time', '20', 'year', 'basically', 'since', 'teenager']"
Fitness,"I got heckled by a random dude on the street the other day as I was walking home from errands, wearing a normal t-shirt and shorts. I was just walking on the sidewalk, minding my own business when this guy coming toward me jumps to the side  as he passes and yells “STOP! Working-out-so-hard, man!” 

It took me a second to process what he’d said, because the aggressive tone belied what was ultimately a nice compliment. I just laughed and carried on down the street.",2025-04-27T12:35:58,"['got', 'heckled', 'random', 'dude', 'street', 'day', 'walking', 'home', 'errand', 'wearing', 'normal', 'tshirt', 'short', 'walking', 'sidewalk', 'minding', 'business', 'guy', 'coming', 'toward', 'jump', 'side', 'pass', 'yell', '“stop', 'workingoutsohard', 'man”', 'took', 'second', 'process', 'he’d', 'said', 'aggressive', 'tone', 'belied', 'ultimately', 'nice', 'compliment', 'laughed', 'carried', 'street']"
Fitness,"I stopped going the gym during the pandemic and only came back in January of this year. I’ve been going consistently since then and I’ve actually recovered most of my strength back, which is super motivating. For me the hard part about starting again was that I’d have to be “weak” again, but now I’m very close to where I was and still progressing linearly!",2025-04-27T19:56:57,"['stopped', 'going', 'gym', 'pandemic', 'came', 'back', 'january', 'year', 'i’ve', 'going', 'consistently', 'since', 'i’ve', 'actually', 'recovered', 'strength', 'back', 'super', 'motivating', 'hard', 'part', 'starting', 'i’d', '“weak”', 'i’m', 'close', 'still', 'progressing', 'linearly']"
Fitness,"Very small victory but finally feel like I can do a good squatting exercise, hack squat specifically, and not experience any knee pain or awkwardness.",2025-04-27T21:58:51,"['small', 'victory', 'finally', 'feel', 'like', 'good', 'squatting', 'exercise', 'hack', 'squat', 'specifically', 'experience', 'knee', 'pain', 'awkwardness']"
Fitness,"A beautiful, cool Sunday morning shoulder day.  Struck up a conversation with a fellow M-F early morning gym goer who was in a bit later like me for Sunday.   Great to meet another person I see almost every day.

Unique machine:  After my shoulder workout, I did a full circuit on the vintage Nautilus Super Forearm machne.  Incredible...it has grip strength, over/under wrist curls, and over/under forearm rotation grips.",2025-04-27T13:27:49,"['beautiful', 'cool', 'sunday', 'morning', 'shoulder', 'day', 'struck', 'conversation', 'fellow', 'mf', 'early', 'morning', 'gym', 'goer', 'bit', 'later', 'like', 'sunday', 'great', 'meet', 'another', 'person', 'see', 'almost', 'every', 'day', 'unique', 'machine', 'shoulder', 'workout', 'full', 'circuit', 'vintage', 'nautilus', 'super', 'forearm', 'machne', 'incredibleit', 'grip', 'strength', 'overunder', 'wrist', 'curl', 'overunder', 'forearm', 'rotation', 'grip']"
Fitness,Went to the gym yesterday for the first time in 2 weeks after being sick! And got in a 5 mile hike!,2025-04-27T19:04:00,"['went', 'gym', 'yesterday', 'first', 'time', '2', 'week', 'sick', 'got', '5', 'mile', 'hike']"
Fitness,"I earned the April Calorie Burn Badge on Garmin Connect.

I cooked dinner at home once this past week.

I did elliptical today after not getting on it for a while (been getting most of my cardio from dancing)

Mostly I'm just happy that I have not ballooned back up to the weight I was at the start of 2024 after slipping on my routine for the past 6 months.",2025-04-28T00:13:01,"['earned', 'april', 'calorie', 'burn', 'badge', 'garmin', 'connect', 'cooked', 'dinner', 'home', 'past', 'week', 'elliptical', 'today', 'getting', 'getting', 'cardio', 'dancing', 'mostly', 'im', 'happy', 'ballooned', 'back', 'weight', 'start', '2024', 'slipping', 'routine', 'past', '6', 'month']"
