subreddit,text,fecha,tokens
Fitness,"How Bad is splitting over mulitple weeks instead of splitting within a week? 
E.g.  Push/Pull/Legs every week vs. Week A) Push / Pull / Push / Pull Week B) 2x Legs?

Edit: Thanks guys, i see it´s a bad idea.",2025-04-28T11:03:36,"['bad', 'splitting', 'mulitple', 'week', 'instead', 'splitting', 'within', 'week', 'eg', 'pushpulllegs', 'every', 'week', 'v', 'week', 'push', 'pull', 'push', 'pull', 'week', 'b', '2x', 'leg', 'edit', 'thanks', 'guy', 'see', 'it´s', 'bad', 'idea']"
Fitness,Is doing calisthenics at home actually viable without a bar to use?,2025-04-28T11:23:16,"['calisthenics', 'home', 'actually', 'viable', 'without', 'bar', 'use']"
Fitness,[removed],2025-04-28T13:15:32,['removed']
Fitness,[removed],2025-04-28T14:14:12,['removed']
Fitness,[removed],2025-04-28T15:46:46,['removed']
Fitness,"So I am kind of a beginner but I cannot stop arching my back for any ab workouts. I am currently bending my legs 90 degrees and as soon as I try to lower them my back slowly starts arching.  
With dead bugs I am getting the same result, as soon as I straighten my one leg, my back slowly starts arching unless I keep my other leg kinda closer to my chest. What do I do and how long to actually properly do ab workouts with no back arching?   
I have been doing leg raises and flutter kicks easily but recently found my back was completely off the ground.",2025-04-28T16:24:50,"['kind', 'beginner', 'cannot', 'stop', 'arching', 'back', 'ab', 'workout', 'currently', 'bending', 'leg', '90', 'degree', 'soon', 'try', 'lower', 'back', 'slowly', 'start', 'arching', 'dead', 'bug', 'getting', 'result', 'soon', 'straighten', 'one', 'leg', 'back', 'slowly', 'start', 'arching', 'unless', 'keep', 'leg', 'kinda', 'closer', 'chest', 'long', 'actually', 'properly', 'ab', 'workout', 'back', 'arching', 'leg', 'raise', 'flutter', 'kick', 'easily', 'recently', 'found', 'back', 'completely', 'ground']"
Fitness,[removed],2025-04-28T18:10:48,['removed']
Fitness,[removed],2025-04-28T18:44:26,['removed']
Fitness,[removed],2025-04-28T19:14:41,['removed']
Fitness,"
I’m running GZCLP.

I recently failed my 3x6 OHP so I had to reset the reps to 3x10. I reset to the weight I failed my 3x10 at previously. I was able to get 10 reps on my first 2 sets but only 6 reps on the last set but last time I did 3x10 I got 9 reps on the last set. Does this mean I got weaker and should I lower the weight? I appreciate if someone help me. Thank you.

I’m worried because this is my first day of 3x10 and I already failed",2025-04-28T19:45:09,"['i’m', 'running', 'gzclp', 'recently', 'failed', '3x6', 'ohp', 'reset', 'rep', '3x10', 'reset', 'weight', 'failed', '3x10', 'previously', 'able', 'get', '10', 'rep', 'first', '2', 'set', '6', 'rep', 'last', 'set', 'last', 'time', '3x10', 'got', '9', 'rep', 'last', 'set', 'mean', 'got', 'weaker', 'lower', 'weight', 'appreciate', 'someone', 'help', 'thank', 'i’m', 'worried', 'first', 'day', '3x10', 'already', 'failed']"
Fitness,"I'm late to the ballgame, but...      
I've really been wanting to get my glutes and hammies in shape.  I have a home gym and no squat rack.  I've been doing the off-the-floor low-weight pause squats slowly to increase the resistance and get the best bang for the low-weight buck (I also get wobbly from time to time and it gets scary.)         
I want to just drop the squats and do RDLs or deadlifts.  Much safer if my form is right, which I believe it is.  If I had a squat rack with safety pins, it would be one thing.  I'd still do bodyweight squats to keep my mobility up.  If you were 65M and wanted glutes and hamstrings but didn't want the injuries, is this what you'd do?       
(also doing leg curls, Bulgarian split squats and leg extensions twice weekly.)",2025-04-28T23:06:35,"['im', 'late', 'ballgame', 'ive', 'really', 'wanting', 'get', 'glute', 'hammies', 'shape', 'home', 'gym', 'squat', 'rack', 'ive', 'offthefloor', 'lowweight', 'pause', 'squat', 'slowly', 'increase', 'resistance', 'get', 'best', 'bang', 'lowweight', 'buck', 'also', 'get', 'wobbly', 'time', 'time', 'get', 'scary', 'want', 'drop', 'squat', 'rdls', 'deadlifts', 'much', 'safer', 'form', 'right', 'believe', 'squat', 'rack', 'safety', 'pin', 'would', 'one', 'thing', 'id', 'still', 'bodyweight', 'squat', 'keep', 'mobility', '65m', 'wanted', 'glute', 'hamstring', 'didnt', 'want', 'injury', 'youd', 'also', 'leg', 'curl', 'bulgarian', 'split', 'squat', 'leg', 'extension', 'twice', 'weekly']"
Fitness,[removed],2025-04-29T03:19:06,['removed']
Fitness,[removed],2025-04-29T06:39:07,['removed']
Fitness,[removed],2025-04-29T08:29:33,['removed']
Fitness,"So im a student that walks 1-2K steps a day, but i run 2-3 miles and row 30-45 minutes 6-7 days a week, along with hypertrophy training 3-5x a week. What activity level should i pick on the TDEE calculator? ive seen multiple people say pick sedentary if youre a student/work in an office, but i dont think that would be accurate for me.",2025-04-29T08:57:59,"['im', 'student', 'walk', '12k', 'step', 'day', 'run', '23', 'mile', 'row', '3045', 'minute', '67', 'day', 'week', 'along', 'hypertrophy', 'training', '35x', 'week', 'activity', 'level', 'pick', 'tdee', 'calculator', 'ive', 'seen', 'multiple', 'people', 'say', 'pick', 'sedentary', 'youre', 'studentwork', 'office', 'dont', 'think', 'would', 'accurate']"
Fitness,Are 5x5 programs disproven or something? Since none are really recommended,2025-04-29T12:48:56,"['5x5', 'program', 'disproven', 'something', 'since', 'none', 'really', 'recommended']"
Fitness,"I'm recovering from a ruptured achilles and cant put any weight on my leg, what are some good back/shoulders exercises I can do at home? I have a FID bench, a pair of 25lb and a pair of 30lb dumbbells. I can do dumbbell rows balancing on the bench with both knees (to keep my foot off the ground) and shrugs sitting down, but that's all I've got.",2025-04-29T18:22:53,"['im', 'recovering', 'ruptured', 'achilles', 'cant', 'put', 'weight', 'leg', 'good', 'backshoulders', 'exercise', 'home', 'fid', 'bench', 'pair', '25lb', 'pair', '30lb', 'dumbbell', 'dumbbell', 'row', 'balancing', 'bench', 'knee', 'keep', 'foot', 'ground', 'shrug', 'sitting', 'thats', 'ive', 'got']"
Fitness,[deleted],2025-04-29T20:29:33,['deleted']
Fitness,If I 35M want to even out my body (disproportionately large glutes and thighs and small arms and chest/back)  — what can I do? A basic barbell routine and lower the volume of lower body exercises? Or spam a few dozen sets of bench and rows 2-3x a week and call it a day??,2025-04-29T21:23:26,"['35m', 'want', 'even', 'body', 'disproportionately', 'large', 'glute', 'thigh', 'small', 'arm', 'chestback', '—', 'basic', 'barbell', 'routine', 'lower', 'volume', 'lower', 'body', 'exercise', 'spam', 'dozen', 'set', 'bench', 'row', '23x', 'week', 'call', 'day']"
Fitness,"Is there any point in changing the exercise machine I use? My gym has treadmills, elliptical, exercise bikes, rowing machines, and more. I want to use them all, would this be an issue?",2025-04-30T05:03:27,"['point', 'changing', 'exercise', 'machine', 'use', 'gym', 'treadmill', 'elliptical', 'exercise', 'bike', 'rowing', 'machine', 'want', 'use', 'would', 'issue']"
Fitness,I’m quite unsatisfied with my butt lately because I feel it suddenly became somewhat saggy. It still looks awesome in pants but I hate it when I see it naked. I workout regularly while my life. I used to run but my legs hurt atm so cannot do that. What would be the best workout routine and way to measure progress? I was thinking 3 days a week for around half an hour butt only. My measure of difficulty is that I make routine harder every time I don’t get muscle ache the day after.,2025-04-30T09:05:09,"['i’m', 'quite', 'unsatisfied', 'butt', 'lately', 'feel', 'suddenly', 'became', 'somewhat', 'saggy', 'still', 'look', 'awesome', 'pant', 'hate', 'see', 'naked', 'workout', 'regularly', 'life', 'used', 'run', 'leg', 'hurt', 'atm', 'cannot', 'would', 'best', 'workout', 'routine', 'way', 'measure', 'progress', 'thinking', '3', 'day', 'week', 'around', 'half', 'hour', 'butt', 'measure', 'difficulty', 'make', 'routine', 'harder', 'every', 'time', 'don’t', 'get', 'muscle', 'ache', 'day']"
Fitness,"Hey! I am a complete beginner here, I am struggling with what routine to pick: The Recommended Routine in r/bodyweightfitness, or the Beginner Routine (For strength training) here.

My main goal is to build strength, like full body, and if possible, for my muscles to be more ""defined"" if that's what they call it, since I am kind of skinny.

I really don't know whether I should go with bodyweight or use weights, some people recommend this and the other that. But there is a gym nearby that has all the equipment though. Your help would be appreciated!",2025-04-30T12:02:15,"['hey', 'complete', 'beginner', 'struggling', 'routine', 'pick', 'recommended', 'routine', 'rbodyweightfitness', 'beginner', 'routine', 'strength', 'training', 'main', 'goal', 'build', 'strength', 'like', 'full', 'body', 'possible', 'muscle', 'defined', 'thats', 'call', 'since', 'kind', 'skinny', 'really', 'dont', 'know', 'whether', 'go', 'bodyweight', 'use', 'weight', 'people', 'recommend', 'gym', 'nearby', 'equipment', 'though', 'help', 'would', 'appreciated']"
Fitness,"Does low weight, higher rep actually build “lean” muscle. I do 20 reps of 25lb dumbbell curls and other exercises with the idea that it will build muscle without bulk. I primarily rock climb so most of my fitness routine is for strengthening muscle without adding weight(bulk.)",2025-04-28T13:46:51,"['low', 'weight', 'higher', 'rep', 'actually', 'build', '“lean”', 'muscle', '20', 'rep', '25lb', 'dumbbell', 'curl', 'exercise', 'idea', 'build', 'muscle', 'without', 'bulk', 'primarily', 'rock', 'climb', 'fitness', 'routine', 'strengthening', 'muscle', 'without', 'adding', 'weightbulk']"
Fitness,"If the talk test says I'm training zone 2 cardio, but my heart rate is close to the zone 3/zone 4 boundary according to % of max heart rate, am I training zone 2 cardio? Also, does this reveal anything about my fitness?

FWIW, it's most pronounced when doing weighted activities on my feet, such as step-ups and carries. On an exercise bike, the talk test and heart rate % give much closer results.",2025-04-28T16:45:39,"['talk', 'test', 'say', 'im', 'training', 'zone', '2', 'cardio', 'heart', 'rate', 'close', 'zone', '3zone', '4', 'boundary', 'according', 'max', 'heart', 'rate', 'training', 'zone', '2', 'cardio', 'also', 'reveal', 'anything', 'fitness', 'fwiw', 'pronounced', 'weighted', 'activity', 'foot', 'stepups', 'carry', 'exercise', 'bike', 'talk', 'test', 'heart', 'rate', 'give', 'much', 'closer', 'result']"
Fitness,"# Post Form Checks as replies to this comment

### For best results, please follow the **[Form Check Guidelines](https://www.reddit.com/r/Fitness/wiki/posting_guidelines#wiki_how_to_post_a_form_check)**.  *Help us help you.*

----


*I am a bot, and this action was performed automatically. Please [contact the moderators of this subreddit](/message/compose/?to=/r/Fitness) if you have any questions or concerns.*",2025-04-29T09:02:00,"['post', 'form', 'check', 'reply', 'comment', 'best', 'result', 'please', 'follow', 'form', 'check', 'guideline', 'help', 'u', 'help', 'bot', 'action', 'performed', 'automatically', 'please', 'contact', 'moderator', 'subredditmessagecomposetorfitness', 'question', 'concern']"
Fitness,"I will soon start calorie counting. I ALWAYS eat the same meal for breakfast, been like this all my life.

Does that make things easier? I.e., just literally calculate the macros and calories of my breakfast and reduce it from the goal and then I only have to worry about the remaining macros/calories?",2025-04-29T20:52:15,"['soon', 'start', 'calorie', 'counting', 'always', 'eat', 'meal', 'breakfast', 'like', 'life', 'make', 'thing', 'easier', 'ie', 'literally', 'calculate', 'macro', 'calorie', 'breakfast', 'reduce', 'goal', 'worry', 'remaining', 'macroscalories']"
Fitness,"How do you guys deal with days where you’re just not on it? Just feeling low energy, not up to usual level. Do you reduce volume or just power through it? In general but particularly when on a calorie deficit",2025-04-29T14:11:28,"['guy', 'deal', 'day', 'you’re', 'feeling', 'low', 'energy', 'usual', 'level', 'reduce', 'volume', 'power', 'general', 'particularly', 'calorie', 'deficit']"
Fitness,"Form check on deadlift please: [https://streamable.com/c5fboo](https://streamable.com/c5fboo)

This is 3\*265lbs, which is 90% of my TM or 80% of my estimated 1RM. Currently doing 531 for beginners program. My lower back has been sore recently so im checking for any rounding, hip height, etc. Thank you",2025-04-29T15:03:19,"['form', 'check', 'deadlift', 'please', '3265lbs', '90', 'tm', '80', 'estimated', '1rm', 'currently', '531', 'beginner', 'program', 'lower', 'back', 'sore', 'recently', 'im', 'checking', 'rounding', 'hip', 'height', 'etc', 'thank']"
Fitness,[removed],2025-04-29T11:57:20,['removed']
Fitness,"Do people with a sixpack hold in/tense up their stomach to a small degree all the time? I have a sixpack and 10% fat according to my scale, but I can still let my belly hang loose. Is this normal? And what is the proper technique for this? Because I think it looks better when I tense it up in certain ways, but then I also feel like it takes too much effort to do all the time.",2025-04-30T07:18:12,"['people', 'sixpack', 'hold', 'intense', 'stomach', 'small', 'degree', 'time', 'sixpack', '10', 'fat', 'according', 'scale', 'still', 'let', 'belly', 'hang', 'loose', 'normal', 'proper', 'technique', 'think', 'look', 'better', 'tense', 'certain', 'way', 'also', 'feel', 'like', 'take', 'much', 'effort', 'time']"
Fitness,"I'm running metallicdpa ppl which says 5x5 on flat bench each session. Going up by 2.5kg on each push day.
Recently I decided to prioritize Smith incline over the flat bench. Should I still be running the same increases per session as long as I can do 5x5? Incline bench is meant to be sightly harder than flat? 

I'm about 8 weeks into lifting now.",2025-04-29T09:11:20,"['im', 'running', 'metallicdpa', 'ppl', 'say', '5x5', 'flat', 'bench', 'session', 'going', '25kg', 'push', 'day', 'recently', 'decided', 'prioritize', 'smith', 'incline', 'flat', 'bench', 'still', 'running', 'increase', 'per', 'session', 'long', '5x5', 'incline', 'bench', 'meant', 'sightly', 'harder', 'flat', 'im', '8', 'week', 'lifting']"
Fitness,[removed],2025-04-29T11:41:22,['removed']
Fitness,Q: Why are people twisting palms from overhand to underhand grip on ring pull ups ?,2025-04-29T12:07:56,"['q', 'people', 'twisting', 'palm', 'overhand', 'underhand', 'grip', 'ring', 'pull', 'ups']"
Fitness,"Hey, I'm looking to get into the gym again after a couple years, I'm still pretty green and I don't know it all so I won't be offended if you try point out the obvious! I'm 19, I weigh about 180 pounds (82kg) 177cm tall. I plan on doing cardio on the way there and back which is about 5 miles total then strength exercises in the gym everyday of the week for the next few weeks.

My question is, would this be over-doing it for a beginner? Or is it a matter of mental fortitude and plodding on no matter what?

EDIT: I should have probably formatted this a bit better but I do plan on looking at some routines and continuing the gym even after a few weeks, just certain circumstances aren't allowing it. I also know that 7 days is overkill and that the body needs rest but I believe it could help build discipline and wont cause any major problems considering its for a few weeks max.",2025-04-29T12:14:43,"['hey', 'im', 'looking', 'get', 'gym', 'couple', 'year', 'im', 'still', 'pretty', 'green', 'dont', 'know', 'wont', 'offended', 'try', 'point', 'obvious', 'im', '19', 'weigh', '180', 'pound', '82kg', '177cm', 'tall', 'plan', 'cardio', 'way', 'back', '5', 'mile', 'total', 'strength', 'exercise', 'gym', 'everyday', 'week', 'next', 'week', 'question', 'would', 'overdoing', 'beginner', 'matter', 'mental', 'fortitude', 'plodding', 'matter', 'edit', 'probably', 'formatted', 'bit', 'better', 'plan', 'looking', 'routine', 'continuing', 'gym', 'even', 'week', 'certain', 'circumstance', 'arent', 'allowing', 'also', 'know', '7', 'day', 'overkill', 'body', 'need', 'rest', 'believe', 'could', 'help', 'build', 'discipline', 'wont', 'cause', 'major', 'problem', 'considering', 'week', 'max']"
Fitness,"Fairly new to upper body workouts (~8 months), and I've noticed something. No matter what variation of rows (seated, standing, dumbell, barbell, support, cable machine etc.), beyond very low weights I start struggling after about 5 reps.

Thing is, that 5 rep number is consistent over a 20kg range. Lower weights feel easier, but the range of motion I get falls apart at just about the same time nonetheless.

Of course everyone is different, and I'm generally trying to move up in weight once I get to the 12 rep range, but I'm just curious if what I've noticed is indicative of anything in particular",2025-04-29T13:03:55,"['fairly', 'new', 'upper', 'body', 'workout', '8', 'month', 'ive', 'noticed', 'something', 'matter', 'variation', 'row', 'seated', 'standing', 'dumbell', 'barbell', 'support', 'cable', 'machine', 'etc', 'beyond', 'low', 'weight', 'start', 'struggling', '5', 'rep', 'thing', '5', 'rep', 'number', 'consistent', '20kg', 'range', 'lower', 'weight', 'feel', 'easier', 'range', 'motion', 'get', 'fall', 'apart', 'time', 'nonetheless', 'course', 'everyone', 'different', 'im', 'generally', 'trying', 'move', 'weight', 'get', '12', 'rep', 'range', 'im', 'curious', 'ive', 'noticed', 'indicative', 'anything', 'particular']"
Fitness,[removed],2025-04-29T13:50:51,['removed']
Fitness,"There's a leg press machine in the gym which shows that it trains quads, hamstrings and glutes.

I've never used a leg press machine, not sure if I ever will, but I'm curious:

It doesn't actually train the hamstrings, right? I assume it's mostly quad training and some glutes involved, but hamstrings would be a bit of a stretch, right?

Otherwise it kind of sounds like a bit too good to be true. A simple machine exercise that trains the full lower body (except the calves, who cares), hmm, not sure about that.",2025-04-29T14:12:11,"['there', 'leg', 'press', 'machine', 'gym', 'show', 'train', 'quad', 'hamstring', 'glute', 'ive', 'never', 'used', 'leg', 'press', 'machine', 'sure', 'ever', 'im', 'curious', 'doesnt', 'actually', 'train', 'hamstring', 'right', 'assume', 'mostly', 'quad', 'training', 'glute', 'involved', 'hamstring', 'would', 'bit', 'stretch', 'right', 'otherwise', 'kind', 'sound', 'like', 'bit', 'good', 'true', 'simple', 'machine', 'exercise', 'train', 'full', 'lower', 'body', 'except', 'calf', 'care', 'hmm', 'sure']"
Fitness,How do I do seated curls without bumping into my thighs/cheeks. I’m having to kinda swing out of the way to get past them. I’m holding the db at one end to give me some more space but I’m still hitting them.,2025-04-29T16:17:19,"['seated', 'curl', 'without', 'bumping', 'thighscheeks', 'i’m', 'kinda', 'swing', 'way', 'get', 'past', 'i’m', 'holding', 'db', 'one', 'end', 'give', 'space', 'i’m', 'still', 'hitting']"
Fitness,[removed],2025-04-29T16:29:32,['removed']
Fitness,Is there any benefit to paying attention to heart rate zones that are based off a percentage of your max heart rate? I keep seeing heart rate zones are only accurate if you get them tested in a lab,2025-04-29T17:29:15,"['benefit', 'paying', 'attention', 'heart', 'rate', 'zone', 'based', 'percentage', 'max', 'heart', 'rate', 'keep', 'seeing', 'heart', 'rate', 'zone', 'accurate', 'get', 'tested', 'lab']"
Fitness,"If a power rack says the weight crutch has a max weight of 310 lbs, does that mean 310 lbs each side ie a 620 lb barbell?",2025-04-29T18:07:26,"['power', 'rack', 'say', 'weight', 'crutch', 'max', 'weight', '310', 'lb', 'mean', '310', 'lb', 'side', 'ie', '620', 'lb', 'barbell']"
Fitness,How often do you switch up your routine and is it necessary to cycle routines for continued progress or is it more a matter of managing progression methods and deload weeks?,2025-04-29T19:01:42,"['often', 'switch', 'routine', 'necessary', 'cycle', 'routine', 'continued', 'progress', 'matter', 'managing', 'progression', 'method', 'deload', 'week']"
Fitness,[removed],2025-04-29T21:43:29,['removed']
Fitness,"Why is it that I’ll go from being able to bar squat to suddenly not be being to, and repeat it? Like I went from being able to do 105 lbs, then when I took a break (like 1 month) from them, I suddenly struggled to do the bar. Then it took me a moment to get back up to 85 pounds. I took another break (like 3 weeks ish) and suddenly I couldn’t do it no more.

Why could this be happening and how do I stop this?",2025-04-29T22:21:08,"['i’ll', 'go', 'able', 'bar', 'squat', 'suddenly', 'repeat', 'like', 'went', 'able', '105', 'lb', 'took', 'break', 'like', '1', 'month', 'suddenly', 'struggled', 'bar', 'took', 'moment', 'get', 'back', '85', 'pound', 'took', 'another', 'break', 'like', '3', 'week', 'ish', 'suddenly', 'couldn’t', 'could', 'happening', 'stop']"
Fitness,"What is the difference between a full body split and a half split?

I’ve looked it up and I’m basically looking for confirmation of my understanding.

Half split is exercising legs one day; chest, shoulders, and back another day.
Full body split is exercising the full body each time.

Which is why I’m needing some confirmation. The name, if I understand it, Full Body Split is kind of a misnomer is it not?",2025-04-29T22:37:27,"['difference', 'full', 'body', 'split', 'half', 'split', 'i’ve', 'looked', 'i’m', 'basically', 'looking', 'confirmation', 'understanding', 'half', 'split', 'exercising', 'leg', 'one', 'day', 'chest', 'shoulder', 'back', 'another', 'day', 'full', 'body', 'split', 'exercising', 'full', 'body', 'time', 'i’m', 'needing', 'confirmation', 'name', 'understand', 'full', 'body', 'split', 'kind', 'misnomer']"
Fitness,Are seated cable rows done in a rowing motion? I've been doing them as hold and release.,2025-04-30T00:39:17,"['seated', 'cable', 'row', 'done', 'rowing', 'motion', 'ive', 'hold', 'release']"
Fitness,Anyone have a go-to beginner-friendly mobility routine for tight hips?,2025-04-30T01:21:37,"['anyone', 'goto', 'beginnerfriendly', 'mobility', 'routine', 'tight', 'hip']"
Fitness,[removed],2025-04-30T01:30:50,['removed']
Fitness,"I want a more pronounced ""bubble butt"" as a guy but I have failed the past 6 months while all my other muscles groups have grown a ton. I cannot figure out what I am doing wrong - my ass is still pretty flat despite lifting a high amount. can somehow judge my glute routine and tell me if its my workout or my genetics? 

**Day 1:** 

\- Bulgarian Split Squat - Glute Focused (minimize quad activation). 3 sets of 8. 

\- Deep Hyperextension, pausing at top. 3 sets of 15

\- Side lying hip abuction. 3 sets of how many I can do. 

**Day 2:**

\- Walking Weighted Lunges - longer strides for glute focus: 3 sets of 15

\- Hip abduction machine. 3 sets of 20.

**Day 3:**

\-Hip Thrusts - 4 sets of 12-15. 

\-Deep Hyperextension, pausing at top. 3 sets of 15

  
that's 10 pretty intense glute sets a week and 12 isolation sets.

Edit: I can’t do deadlifts or free bb squats due to a back issue",2025-04-30T02:00:42,"['want', 'pronounced', 'bubble', 'butt', 'guy', 'failed', 'past', '6', 'month', 'muscle', 'group', 'grown', 'ton', 'cannot', 'figure', 'wrong', 'as', 'still', 'pretty', 'flat', 'despite', 'lifting', 'high', 'amount', 'somehow', 'judge', 'glute', 'routine', 'tell', 'workout', 'genetics', 'day', '1', 'bulgarian', 'split', 'squat', 'glute', 'focused', 'minimize', 'quad', 'activation', '3', 'set', '8', 'deep', 'hyperextension', 'pausing', 'top', '3', 'set', '15', 'side', 'lying', 'hip', 'abuction', '3', 'set', 'many', 'day', '2', 'walking', 'weighted', 'lunge', 'longer', 'stride', 'glute', 'focus', '3', 'set', '15', 'hip', 'abduction', 'machine', '3', 'set', '20', 'day', '3', 'hip', 'thrust', '4', 'set', '1215', 'deep', 'hyperextension', 'pausing', 'top', '3', 'set', '15', 'thats', '10', 'pretty', 'intense', 'glute', 'set', 'week', '12', 'isolation', 'set', 'edit', 'can’t', 'deadlifts', 'free', 'bb', 'squat', 'due', 'back', 'issue']"
Fitness,Can I replace step ups with single leg press ? Is single leg press better for hamstring and glute growth than steps ups? I struggle to feel step ups in my glutes and it’s kinda awkward to do at my gym,2025-04-30T02:01:36,"['replace', 'step', 'ups', 'single', 'leg', 'press', 'single', 'leg', 'press', 'better', 'hamstring', 'glute', 'growth', 'step', 'ups', 'struggle', 'feel', 'step', 'ups', 'glute', 'it’s', 'kinda', 'awkward', 'gym']"
Fitness,[removed],2025-04-30T03:23:24,['removed']
Fitness,"Should I bother with my fitness journey or give up?

I have gotten weaker, I am under too much stress to track my protein, and I don't know how to execute even the most basic of workouts properly, with any intensity; I just give up when the workout gets difficult, and I am also nervous in the gym.

I am a 105kg male been working out for a year and can only bench 60kgs, squat 100, and deadlift 110kgs.

I am depressed and have wasted my time in the gym; is there a solution for me, or is getting strong and having a nice physique just not for me?",2025-04-30T08:45:04,"['bother', 'fitness', 'journey', 'give', 'gotten', 'weaker', 'much', 'stress', 'track', 'protein', 'dont', 'know', 'execute', 'even', 'basic', 'workout', 'properly', 'intensity', 'give', 'workout', 'get', 'difficult', 'also', 'nervous', 'gym', '105kg', 'male', 'working', 'year', 'bench', '60kgs', 'squat', '100', 'deadlift', '110kgs', 'depressed', 'wasted', 'time', 'gym', 'solution', 'getting', 'strong', 'nice', 'physique']"
